MCQ,Choices,Correct
What is the main goal of machine learning?,a: To perform tasks with explicit instructions | b: To learn from data and generalize to unseen data | c: To ignore data and focus on theoretical frameworks | d: To memorize data without understanding it,b
Who coined the term 'machine learning' in 1959?,a: Donald Hebb | b: Walter Pitts | c: Arthur Samuel | d: Warren McCulloch,c
What is the difference between machine learning and data mining?,"a: Machine learning focuses on prediction, while data mining focuses on discovering unknown properties in data | b: Machine learning uses unsupervised learning, while data mining uses supervised learning | c: Machine learning is used for image processing, while data mining is used for speech recognition | d: Machine learning is a subset of data mining",a
What is the goal of generalization in machine learning?,a: To memorize the training data perfectly | b: To minimize the loss on unseen samples | c: To overfit the model to the training data | d: To ignore the training data completely,b
What is the relationship between machine learning and statistics?,"a: Machine learning and statistics have different goals but use the same methods | b: Statistics focuses on prediction, while machine learning focuses on population inferences | c: Statistics uses supervised learning, while machine learning uses unsupervised learning | d: Machine learning draws population inferences from a sample",a
